{
  "audit_id": "troves_hyper_lst_vaults_sherlock_2025",
  "project": "Troves Hyper LST Vaults",
  "auditor": "Sherlock",
  "date": "2025-01-01",
  "source_url": "https://github.com/sherlock-protocol/sherlock-reports/blob/main/audits/2025_09_23_Final_Vesu_Starknet_Vault_Kit_Collaborative_Audit_Report.pdf",
  "repository": "unknown",
  "scope_files": [
    "decoder_and_sanitizer/avnu_exchange_decoder_and_sanitizer.cairo",
    "decoder_and_sanitizer/interface.cairo",
    "sanitizer.cairo",
    "types.cairo",
    "sanitizer/erc4626_decoder_and_sanitizer.cairo",
    "sanitizer/interface.cairo",
    "packages/vault_allocator/src/decoders_and_sanitizers/interface.cairo",
    "sanitizer/multiply_decoder_and_sanitizer.cairo",
    "sanitizer/uncap_decoder_and_sanitizer.cairo",
    "sanitizer/vesu_decoder_and_sanitizer.cairo",
    "sanitizer/vesu_v2_decoder_and_sanitizer.cairo",
    "packages/vault_allocator/src/integration_interfaces/avnu.cairo",
    "packages/vault_allocator/src/integration_interfaces/pragma.cairo",
    "packages/vault_allocator/src/integration_interfaces/vesu.cairo",
    "packages/vault_allocator/src/lib.cairo",
    "packages/vault_allocator/src/manager/errors.cairo",
    "packages/vault_allocator/src/manager/interface.cairo",
    "packages/vault_allocator/src/manager/manager.cairo",
    "middleware.cairo",
    "packages/vault_allocator/src/middlewares/avnu_middleware/errors.cairo",
    "packages/vault_allocator/src/middlewares/avnu_middleware/interface.cairo",
    "packages/vault_allocator/src/periphery/price_router/errors.cairo",
    "packages/vault_allocator/src/periphery/price_router/interface.cairo",
    "packages/vault_allocator/src/periphery/price_router/price_router.cairo",
    "packages/vault_allocator/src/vault_allocator/errors.cairo",
    "packages/vault_allocator/src/vault_allocator/interface.cairo",
    "packages/vault_allocator/src/vault_allocator/vault_allocator.cairo",
    "packages/vault/src/lib.cairo",
    "packages/vault/src/redeem_request/errors.cairo",
    "packages/vault/src/redeem_request/interface.cairo",
    "packages/vault/src/redeem_request/redeem_request.cairo",
    "packages/vault/src/vault/errors.cairo",
    "packages/vault/src/vault/interface.cairo",
    "packages/vault/src/vault/vault.cairo",
    "vault.cairo",
    "avnu_middleware.cairo",
    "multiply_decoder_and_sanitizer.cairo",
    "price_router.cairo"
  ],
  "finding_count": 7,
  "severity_counts": {
    "high": 1,
    "low": 2,
    "medium": 4
  },
  "status_summary": {
    "reported": 7
  },
  "notes": "Auto-normalized from ingest manifest and extracted report text."
}
