{
  "audit_id": "hyperlane_starknet_audit_1_zellic_unknown",
  "project": "Hyperlane Starknet Audit 1",
  "auditor": "Zellic",
  "date": "2024-07-09",
  "source_url": "https://github.com/Zellic/publications/blob/master/Hyperlane%20Starknet%20-%20Zellic%20Audit%20Report.pdf",
  "repository": "https://github.com/hyperlane-xyz",
  "scope_files": [
    "lib.cairo",
    "interfaces.cairo",
    "contracts/isms/pausable_ism.cairo",
    "contracts/isms/trusted_relayer_ism.cairo",
    "contracts/isms/noop_ism.cairo",
    "contracts/isms/routing/domain_routing_ism.cairo",
    "contracts/isms/routing/default_fallback_routing_ism.cairo",
    "contracts/isms/multisig/merkleroot_multisig_ism.cairo",
    "contracts/isms/multisig/messageid_multisig_ism.cairo",
    "contracts/isms/multisig/validator_announce.cairo",
    "contracts/isms/aggregation/aggregation.cairo",
    "contracts/mailbox.cairo",
    "contracts/libs/message.cairo",
    "contracts/libs/multisig/message_id_ism_metadata.cairo",
    "contracts/libs/multisig/merkleroot_ism_metadata.cairo",
    "contracts/libs/checkpoint_lib.cairo",
    "contracts/libs/aggregation_ism_metadata.cairo",
    "contracts/hooks/merkle_tree_hook.cairo",
    "contracts/hooks/libs/standard_hook_metadata.cairo",
    "contracts/hooks/protocol_fee.cairo",
    "contracts/client/mailboxclient_component.cairo",
    "contracts/client/mailboxclient.cairo",
    "utils/keccak256.cairo",
    "utils/store_arrays.cairo",
    "aggregation_ism_metadata.cairo",
    "aggregation.cairo",
    "keccak256.cairo",
    "checkpoint_lib.cairo",
    "message.cairo",
    "validator_announce.cairo",
    "merkleroot_multisig_ism.cairo",
    "messageid_multisig_ism.cairo",
    "sageid_multisig_ism.cairo",
    "protocol_fee.cairo",
    "mailbox.cairo",
    "mailboxclient_component.cairo",
    "gregation.cairo",
    "default_fallback_routing_ism.cairo",
    "default_routing_ism.cairo",
    "domain_routing_ism.cairo"
  ],
  "finding_count": 22,
  "severity_counts": {
    "critical": 5,
    "high": 5,
    "info": 2,
    "low": 5,
    "medium": 5
  },
  "status_summary": {
    "reported": 22
  },
  "notes": "Auto-normalized from ingest manifest and extracted report text."
}
