{
  "audit_id": "forgeyields_csc_cairo_security_clan_unknown",
  "project": "ForgeYields CSC",
  "auditor": "Cairo Security Clan",
  "date": "2025-09-01",
  "source_url": "https://github.com/ForgeYields/audits/blob/main/Forge%20-%20Csc%20Audit%20Report.pdf",
  "repository": "https://github.com/ForgeYields",
  "scope_files": [
    "/src/lib.cairo",
    "/packages/controller/src/lib.cairo",
    "/packages/controller/src/constants.cairo",
    "/packages/controller/src/messages.cairo",
    "/packages/controller/src/controller/controller.cairo",
    "/packages/controller/src/controller/errors.cairo",
    "/packages/controller/src/controller/interface.cairo",
    "/packages/controller/src/factory/errors.cairo",
    "/packages/controller/src/factory/factory.cairo",
    "/packages/controller/src/factory/interface.cairo",
    "gateway/src/factory/errors.cairo",
    "gateway/src/factory/factory.cairo",
    "gateway/src/factory/interface.cairo",
    "request/errors.cairo",
    "request/interface.cairo",
    "request.cairo",
    "gateway/errors.cairo",
    "gateway/interface.cairo",
    "gateway.cairo",
    "gateway/src/utils/errors.cairo",
    "gateway/src/utils/interface.cairo",
    "helper.cairo",
    "gateway/src/lib.cairo",
    "/home/erim/csc/cvm/packages/controller/src/test/test_controller.cairo",
    "/home/erim/csc/cvm/packages/controller/src/test/test_p2p.cairo",
    "/home/erim/csc/cvm/packages/token_gateway/src/utils/interface.cairo"
  ],
  "finding_count": 8,
  "severity_counts": {
    "best_practice": 4,
    "info": 3,
    "medium": 1
  },
  "status_summary": {
    "acknowledged": 3,
    "fixed": 3,
    "unresolved": 2
  },
  "notes": "Auto-normalized from ingest manifest and extracted report text."
}
