{
  "audit_id": "atomiq_exchange_reaudit_cairo_security_clan_unknown",
  "project": "Atomiq Exchange Reaudit",
  "auditor": "Cairo Security Clan",
  "date": "2026-03-08",
  "source_url": "https://github.com/atomiqlabs/atomiq-readme/blob/main/csc-starknet_cairo-atomiq-audit.pdf",
  "repository": "https://github.com/atomiqlabs/atomiq-contracts-starknet/",
  "scope_files": [
    "packages/btc_nonced_output_claim_handler/src/lib.cairo",
    "packages/btc_output_claim_handler/src/lib.cairo",
    "packages/btc_relay/src/constants.cairo",
    "packages/btc_relay/src/lib.cairo",
    "packages/btc_relay/src/state.cairo",
    "packages/btc_relay/src/structs.cairo",
    "packages/btc_relay/src/utils.cairo",
    "packages/btc_relay/src/state/fork.cairo",
    "packages/btc_relay/src/structs/blockheader.cairo",
    "packages/btc_relay/src/structs/stored_blockheader.cairo",
    "packages/btc_relay/src/utils/difficulty.cairo",
    "packages/btc_relay/src/utils/endianness.cairo",
    "packages/btc_relay/src/utils/nbits.cairo",
    "packages/btc_relay/src/utils/u256_utils.cairo",
    "packages/btc_txid_claim_handler/src/lib.cairo",
    "packages/btc_utils/src/bitcoin_merkle_tree.cairo",
    "packages/btc_utils/src/bitcoin_tx.cairo",
    "packages/btc_utils/src/byte_array.cairo",
    "packages/btc_utils/src/compact_size.cairo",
    "packages/btc_utils/src/lib.cairo",
    "packages/common/src/handlers.cairo",
    "packages/common/src/lib.cairo",
    "packages/common/src/handlers/claim.cairo",
    "packages/common/src/handlers/refund.cairo",
    "packages/erc20_utils/src/lib.cairo",
    "packages/escrow_manager/src/components.cairo",
    "packages/escrow_manager/src/events.cairo",
    "packages/escrow_manager/src/lib.cairo",
    "packages/escrow_manager/src/sighash.cairo",
    "packages/escrow_manager/src/state.cairo",
    "packages/escrow_manager/src/structs.cairo",
    "packages/escrow_manager/src/utils.cairo",
    "packages/escrow_manager/src/components/escrow_storage.cairo",
    "packages/escrow_manager/src/components/lp_vault.cairo",
    "packages/escrow_manager/src/components/reputation.cairo",
    "packages/escrow_manager/src/state/escrow.cairo",
    "packages/escrow_manager/src/state/reputation.cairo",
    "packages/escrow_manager/src/structs/escrow.cairo",
    "packages/escrow_manager/src/utils/snip6.cairo",
    "packages/hashlock_claim_handler/src/lib.cairo"
  ],
  "finding_count": 8,
  "severity_counts": {
    "best_practice": 4,
    "high": 3,
    "info": 1
  },
  "status_summary": {
    "acknowledged": 5,
    "fixed": 3
  },
  "notes": "Auto-normalized from ingest manifest and extracted report text."
}
